{"schema_version":"local-monitor-session-timeline.response.v2","workspace_revision":"2ab689c71c10f9df53391d137f0d54e6dcdebdab38c11bbf3fb337d62ffee783","session_id":"018f0000-0000-7000-8000-000000000001","execution_id":"9a5590c8-46e3-7069-af48-3844d2bf17a4","parent_node_id":null,"items":[{"node_id":"node-a8a773d6614d5030f505ff195b452dd6","execution_id":"9a5590c8-46e3-7069-af48-3844d2bf17a4","parent_node_id":"node-2db4028cf76015c954848d7dcbb5deca","relationship_authority":"exact","kind":"event","name":{"state":"recorded","text":"user.message"},"lifecycle":"completed","status":"completed","timing":{"state":"recorded","started_at":"2026-08-26T01:02:03.0000000+00:00","ended_at":"2026-08-26T01:02:03.0000000+00:00","duration_ms":0},"activity":{"skill":{"state":"not_observed","count":null},"tool":{"state":"not_observed","count":null},"subagent":{"state":"not_observed","count":null},"error":{"state":"not_observed","count":null},"retry":{"state":"not_observed","count":null}},"tokens":{"authority":"none","state":"not_observed","available_execution_count":0,"total_execution_count":1,"input":{"state":"not_observed","value":null},"output":{"state":"not_observed","value":null},"total":{"state":"not_observed","value":null},"reasoning":{"state":"not_observed","value":null},"cache_read":{"state":"not_observed","value":null},"cache_creation":{"state":"not_observed","value":null},"new_input":{"state":"not_observed","value":null},"cache_read_ratio_basis_points":{"state":"not_observed","value":null}},"child_count":0,"has_more_children":false,"collapsed_children":{"state":"complete","count":0},"content_parts":[],"source_references":{"state":"recorded","references":[{"source_kind":"session_event","source_identity":"018f0000-0000-7000-8000-000000000004","trace_id":null,"span_id":null,"event_id":"018f0000-0000-7000-8000-000000000004"}]}}],"next_cursor":"AUkgbmJd5c6IwSguh0id0F6RAkJEzF91zJPtLo_Z48WxAAjfAw2j83eAAAAAAAAAAAFub2RlLWE4YTc3M2Q2NjE0ZDUwMzBmNTA1ZmYxOTViNDUyZGQ2cQoE2yJac7E7-6TIGTqAsKM2xT_-_cmkFI3nE1STrNE"}